Wang2019	Edge cloud offloading algorithms: Issues, methods, and perspectives	2019	https://www.scopus.com/inward/record.uri?eid=2-s2.0-85062443868&doi=10.1145%2f3284387&partnerID=40&md5=1db03aa07565de33a82c45c17efe1e86	Sim (Survey)								
Fan2019	Minimum-cost offloading for collaborative task execution of MEC-assisted platooning	2019	https://www.scopus.com/inward/record.uri?eid=2-s2.0-85061847285&doi=10.3390%2fs19040847&partnerID=40&md5=1e8051df3c00ce97d66e2d12444b6c6e	Não (Mas não usa apps)								
Meng2019215	Radio resource allocation scheme for drone-assisted AR applications	2019	https://www.scopus.com/inward/record.uri?eid=2-s2.0-85063693262&doi=10.1109%2fI-SPAN.2018.00042&partnerID=40&md5=eeefe0b9467648457dc877e771b6e92e	Sim (Não foca em MC)								
Li2019323	Cross-layer collaboration handoff mechanism based on multi-attribute decision in mobile computation offloading	2019	https://www.scopus.com/inward/record.uri?eid=2-s2.0-85031112488&doi=10.1007%2fs00500-017-2881-3&partnerID=40&md5=6162a2e1259813b25329146e0fe4ef33	Não (Mas não usa apps)								
Wu2019	Wireless Powered User Cooperative Computation in Mobile Edge Computing Systems	2019	https://www.scopus.com/inward/record.uri?eid=2-s2.0-85063245787&doi=10.1109%2fGLOCOMW.2018.8644186&partnerID=40&md5=75cd17d5b8cc53da5fb29b47ab567af6	Sim (Workshop)*								
Kan2019	QoS-Aware Mobile Edge Computing System: Multi-Server Multi-User Scenario	2019	https://www.scopus.com/inward/record.uri?eid=2-s2.0-85063489723&doi=10.1109%2fGLOCOMW.2018.8644384&partnerID=40&md5=de1c36cb392a76cfc5668e18da5e889d	Sim (Workshop)*								
Zhu2019678	An online learning approach to wireless computation offloading	2019	https://www.scopus.com/inward/record.uri?eid=2-s2.0-85063090861&doi=10.1109%2fGlobalSIP.2018.8646562&partnerID=40&md5=98beb924cf0df56e4446efd7196634b9	Sim (Short Paper)								
Arun20191311	An efficient job sharing strategy for prioritized tasks in mobile cloud computing environment using ACS-JS algorithm	2019	https://www.scopus.com/inward/record.uri?eid=2-s2.0-85063540325&partnerID=40&md5=6c933ed644462fcb7d48d073aded0836	Não (Mas não usa apps)								
Wang20192450	Multi-antenna NOMA for computation offloading in multiuser mobile edge computing systems	2019	https://www.scopus.com/inward/record.uri?eid=2-s2.0-85056710043&doi=10.1109%2fTCOMM.2018.2881725&partnerID=40&md5=147af5940271feb60dc19966c1d68c06	Não (Mas não usa apps)								
He20191750	D2D communications meet mobile edge computing for enhanced computation capacity in cellular networks	2019	https://www.scopus.com/inward/record.uri?eid=2-s2.0-85062960310&doi=10.1109%2fTWC.2019.2896999&partnerID=40&md5=f75454e96d3cbce2327aa7bc380c7fbc	Não (Mas não usa apps)								
Govindaraj2019	Investigation of uninterrupted service live migration using software-defined networking	2019	https://www.scopus.com/inward/record.uri?eid=2-s2.0-85073871487&doi=10.1109%2fNetSys.2019.8854521&partnerID=40&md5=b34f32d0eed809b94e70449ac7b78fb9	Sim (Não foca em MC)								
Li2019798	Task Offloading for UAV-based Mobile Edge Computing via Deep Reinforcement Learning	2019	https://www.scopus.com/inward/record.uri?eid=2-s2.0-85063075333&doi=10.1109%2fICCChina.2018.8641189&partnerID=40&md5=9b4242dc31bedbc79271305bc80e0cfb	Não (Mas não usa apps)								
												
												
												
												
												
												
												
												
												
												
												
												
												
												
												
												
												
												
												
												
												
												
												
												
												
												
												
												
												
												
												
												
												
												
												
												
												
												
												
												
												
												
												
												
												
												
												
												
												
												
												
												
												
												
												
												
												
												
												
												
												
												
												
												
												
												
												
												
												
												
												
												
												
												
												
												
												
												
												
												
												
												
												
												
												
												
												
												
												
												
												
												
												
												
												
												
												
												
												
												
												
												
												
												
												
												
												
												
												
												
												
												
												
												
												
												
												
												
												
												
												
												
												
												
												
												
												
												
												
												
												
												
												
												
												
												
												
												
												
												
												
												
												
												
												
												
												
												
												
												
												
												
												
												
												
												
												
												
												
												
												
												
												
												
												
												
												
												
												
												
												
												
												
												
												
												
												
												
												
												
												
												
												
												
												
												
												
												
												
												
												
												
												
												
												
												
												
												
												
												
												
												
												
												
												
												
												
												
												
												
												
												
												
												
												
												
												
												
												
												
												
												
												
												
												
												
												
												
												
												
												
												
												
												
												
												
												
												
												
												
												
												
												
												
												
												
												
												
												
												
												
												
												
												
												
												
												
												
												
												
												
												
												
												
												
												
												
												
												
												
												
												
												
												
												
												
												
												
												
												
												
												
												
												
												
												
												
												
												
												
												
												
												
												
												
												
												
												
												
												
												
												
												
												
												
												
												
												
												
												
												
												
												
												
												
												
												
												
												
												
												
												
												
												
												
												
												
												
												
												
												
												
												
												
												
												
												
												
												
												
												
												
												
												
												
												
												
												
												
												
												
												
												
												
												
												
												
												
												
												
												
												
												
												
												
												
												
												
												
												
												
												
												
												
												
												
												
												
												
												
												
												
												
												
												
												
												
												
												
												
												
												
												
												
												
												
												
												
												
												
												
												
												
												
												
												
												
												
												
												
												
												
												
												
												
												
												
												
												
												
												
												
												
												
												
												
												
												
												
												
												
												
												
												
												
												
												
												
												
												
												
												
												
												
												
												
												
												
												
												
												
												
												
												
												
												
												
												
												
												
												
												
												
												
												
												
												
												
												
												
												
												
												
												
												
												
												
												
												
												
												
												
												
												
												
												
												
												
												
												
												
												
												
												
												
												
												
												
												
												
												
												
												
												
												
												
												
												
												
												
												
												
												
												
												
												
												
												
												
												
												
												
												
												
												
												
												
												
												
												
												
												
												
												
												
												
												
												
												
												
												
												
												
												
												
												
												
												
												
												
												
												
												
												
												
												
												
												
												
												
												
												
												
												
												
												
												
												
												
												
												
												
												
												
												
												
												
												
												
												
												
												
												
												
												
												
												
												
												
												
												
												
												
												
												
												
												
												
												
												
												
												
												
												
												
												
												
												
												
												
												
												
												
												
												
												
												
												
												
												
												
												
												
												
												
												
												
												
												
												
												
												
												
												
												
												
												
												
												
												
												
												
												
												
												
												
												
												
												
												
												
												
												
												
												
												
												
												
												
												
												
												
												
												
												
												
												
												
												
												
												
												
												
												
												
												
												
												
												
												
												
												
												
												
												
												
												
												
												
												
												
												
												
												
												
												
												
												
												
												
												
												
												
												
												
												
												
												
												
												
												
												
												
												
												
												
												
												
												
												
												
												
												
												
												
												
												
												
												
												
												
												
												
												
												
												
												
												
												
												
												
												
												
												
												
												
												
												
												
												
												
												
												
												
												
												
												
												
												
												
												
												
												
												
												
												
												
												
												
												
												
												
												
												
												
												
												
												
												
												
												
												
												
												
												
												
												
												
												
												
												
												
												
												
												
												
												
												
												
												
												
												
												
												
												
												
												
												
												
												
												
												
												
												
												
												
												
												
												
												
												
												
												
												
												
												
												
												
												
												
												
												
												
												
												
												
												
												
												
												
												
												
												
												
												
												
												
												
												
												
												
												
												
												
												
												
												
												
												
												
												
												
												
												
												
												
												
												
												
												
												
												
												
												
												
												
												
												
												
												
												
												
												
												
												
												
												
												
												
												
												
												
												
												
												
												
												
												
												
												
												
												
												
												
												
												
												
												
												
												
												
												
												
												
												
												
												
												
												
												
												
												
												
												
												
												
												
												
												
												
												
												
												
												
												
												
												
												
												
												
												
												
												
												
												
												
												
												
												
												
												
												
												
												
												
												
												
												
												
												
												
												
												
												
												
												
												
												
												
												
												
												
												
												
												
												
												
												
												
												
												
												
												
												
												
												
												
												
												
												
												
												
												
												
												
												
												
												
												
												
												
												
												
												
												
												
												
												
												
												
												
												
												
												
												
												
												
												
												
												
												
												
												
												
												
												
												
												
												
												
												
												
												
												
												
												
												
												
												
												
												
												
												
												
												
												
												
												
												
												
												
												
												
												
												
												
												
												
												
												
												
												
												
												
												
												
												
												
												
												
												
												
												
												
												
												
												
												
												
												
												
												
												
												
												
												
												
												
												
												
												
												
												
												
												
												
												
												
												
												
												
												
												
												
												
												
												
												
												
												
												
												
												
												
												
												
												
												
												
												
												
												
												
												
												
												
												
												
												
												
												
												
												
												
												
												
												
												
												
												
												
												
												
												
												
												
												
												
												
												
												
												
												
												
												
												
												
												
												
												
												
												
												
												
												
												
												
												
												
												
												
												
												
												
												
												
												
												
												
												
												
												
												
												
												
												
												
												
												
												
												
												
												
												
												
												
												
												
												
												
												
												
												
												
												
												
												
												
												
												
												
												
												
												
												
												
												
												
												
												
												
												
												
												
												
												
												
												
												
												
												
												
												
												
												
												
												
												
												
												
												
												
												
												
												
												
												
												
												
												
												
												
												
												
												
												
												
												
												
												
												
												
												
												
												
												
												
												
												
												
												
												
												
												
												
												
												
												
												
												
												
												
												
												
												
												
												
												
												
												
												
												
												
												
												
												
												
												
												
												
												
												
												
												
												
												
												
												
												
												
												
												
												
												
												
												
												
												
												
												
												
												
												
												
												
												
												
												
												
												
												
												
												
												
												
												
												
												
												
												
												
												
												
												
												
												
												
												
												
												
												
												
												
												
												
												
												
												
												
												
												
												
												
												
												
												
												
												
												
												
												
												
												
												
												
												
												
												
												
												
												
												
												
												
												
												
												
												
												
												
												
												
												
												
												
												
												
												
												
												
												
												
												
												
												
												
												
												
												
												
												
												
												
												
												
												
												
												
												
												
												
												
												
												
												
												
												
												
												
												
												
												
												
												
												
												
												
												
												
												
												
												
												
												
												
												
												
												
												
												
												
												
												
												
												
												
												
												
												
												
												
												
												
												
												
												
												
												
												
												
												
												
												
												
												
												
												
												
												
												
												
												
												
												
												
												
												
												
												
												
												
												
												
												
												
												
												
												
												
												
												
												
												
												
												
												
												
												
												
												
												
												
												
												
												
												
												
												
												
												
												
												
												
												
												
												
												
												
												
												
												
												
												
												
												
												
												
												
												
												
												
												
												
												
												
												
												
												
												
												
												
												
												
												
												
												
												
												
												
												
												
												
												
												
												
												
												
												
												
												
												
												
												
												
												
												
												
												
												
												
												
												
												
												
												
												
												
												
												
												
												
												
												
												
												
												
												
												
												
												
												
												
												
												
												
												
												
												
												
												
												
												
												
												
												
												
												
												
												
												
												
